{"checks":["strict_source_json_reparsed","canonical_plan_binding_recomputed","canonical_run_binding_recomputed","declared_run_lifetimes_rechecked","cross_domain_test_matrix_rechecked","sensor_topology_rechecked","sensor_window_coverage_recomputed","allowed_delivery_controls_recomputed","unexpected_canary_paths_recomputed","unauthorized_flows_recomputed","post_termination_residue_recomputed","producer_evaluation_reproduced"],"documents":{"evaluation":{"document_sha256":"c8423b3ab8b332b34ce31b6e2217b274d28631e0007de303693faa36274901ea","payload_base64":"eyJlbmdpbmUiOnsibmFtZSI6Imx1cmViZW5jaC1sdXJlY2hhbm5lbCIsInZlcnNpb24iOiIxLjAuMCJ9LCJldmFsdWF0ZWRfYXQiOiIyMDI2LTA5LTA1VDAwOjA4OjAwWiIsImV2YWx1YXRpb25faWQiOiJpc29sYXRpb24tb2JzZXJ2YXRpb24tMS1ldmFsdWF0aW9uIiwiZmluZGluZ3MiOltdLCJsaW1pdGF0aW9ucyI6WyJjYW5hcnlfYWJzZW5jZV9vbmx5X2FwcGxpZXNfdG9fZGVjbGFyZWRfY2hhbm5lbHNfc2Vuc29yc193aW5kb3dzX2FuZF9ydW5zIiwic2Vuc29yX2NvbXBsZXRlbmVzc19pc19vcGVyYXRvcl9hc3NlcnRlZF9ub3RfaW5kZXBlbmRlbnRseV9kaXNjb3ZlcmVkIiwiY2FuYXJpZXNfZG9fbm90X2V4ZWN1dGVfZXhwbG9pdHNfb3JfZXN0YWJsaXNoX3VuaXZlcnNhbF9ub25pbnRlcmZlcmVuY2UiLCJwYXNzaW5nX2lzX25vdF9jb250YWlubWVudF9zYWZldHlfY29tcGxpYW5jZV9jZXJ0aWZpY2F0aW9uX29yX2RlcGxveW1lbnRfYXV0aG9yaXphdGlvbiJdLCJwbGFuIjp7ImNhbXBhaWduX2lkIjoiaXNvbGF0aW9uLWNhbXBhaWduLTEiLCJjaGFubmVscyI6W3siYXV0aG9yaXplZCI6dHJ1ZSwiY2hhbm5lbF9jbGFzcyI6ImFwcHJvdmVkX2NvbGxhYm9yYXRpb24iLCJjaGFubmVsX2lkIjoiYXBwcm92ZWQtY29sbGFiIn0seyJhdXRob3JpemVkIjpmYWxzZSwiY2hhbm5lbF9jbGFzcyI6InBhY2thZ2Vfc2VydmljZSIsImNoYW5uZWxfaWQiOiJwYWNrYWdlLWNhY2hlIn0seyJhdXRob3JpemVkIjpmYWxzZSwiY2hhbm5lbF9jbGFzcyI6ImZpbGVzeXN0ZW0iLCJjaGFubmVsX2lkIjoic2hhcmVkLWZpbGVzeXN0ZW0ifV0sImNyZWF0ZWRfYXQiOiIyMDI2LTA5LTA1VDAwOjAwOjAwWiIsImVudmlyb25tZW50Ijp7ImVudmlyb25tZW50X2lkIjoicmVzZWFyY2gtc2FuZGJveC0xIiwidGVuYW50X2lkIjoidGVuYW50LTEifSwibGltaXRhdGlvbnMiOlsiY2FuYXJ5X2Fic2VuY2Vfb25seV9hcHBsaWVzX3RvX2RlY2xhcmVkX2NoYW5uZWxzX3NlbnNvcnNfd2luZG93c19hbmRfcnVucyIsInNlbnNvcl9jb21wbGV0ZW5lc3NfaXNfb3BlcmF0b3JfYXNzZXJ0ZWRfbm90X2luZGVwZW5kZW50bHlfZGlzY292ZXJlZCIsImNhbmFyaWVzX2RvX25vdF9leGVjdXRlX2V4cGxvaXRzX29yX2VzdGFibGlzaF91bml2ZXJzYWxfbm9uaW50ZXJmZXJlbmNlIiwicGFzc2luZ19pc19ub3RfY29udGFpbm1lbnRfc2FmZXR5X2NvbXBsaWFuY2VfY2VydGlmaWNhdGlvbl9vcl9kZXBsb3ltZW50X2F1dGhvcml6YXRpb24iXSwicG9saWN5Ijp7InJlcXVpcmVfYWxsX2RlbGl2ZXJ5X2NvbnRyb2xzIjp0cnVlLCJyZXF1aXJlX2NvbXBsZXRlX3NlbnNvcl93aW5kb3dzIjp0cnVlLCJyZXF1aXJlX3plcm9fcmVzaWR1YWxfZmxvd3MiOnRydWUsInJlcXVpcmVfemVyb191bmF1dGhvcml6ZWRfZmxvd3MiOnRydWV9LCJwcml2YWN5Ijp7ImNhbmFyeV9wYXlsb2FkcyI6ImV4Y2x1ZGVkX2RpZ2VzdF9vbmx5IiwiY3VzdG9tZXJfY29udGVudCI6ImV4Y2x1ZGVkIiwic2VjcmV0cyI6ImV4Y2x1ZGVkIn0sInJ1bnMiOlt7ImVuZGVkX2F0IjoiMjAyNi0wOS0wNVQwMDowNTowMFoiLCJpc29sYXRpb25fZG9tYWluX2lkIjoiZG9tYWluLWEiLCJydW5faWQiOiJydW4tYSIsInN0YXJ0ZWRfYXQiOiIyMDI2LTA5LTA1VDAwOjAxOjAwWiIsInRlbmFudF9pZCI6InRlbmFudC0xIn0seyJlbmRlZF9hdCI6bnVsbCwiaXNvbGF0aW9uX2RvbWFpbl9pZCI6ImRvbWFpbi1iIiwicnVuX2lkIjoicnVuLWIiLCJzdGFydGVkX2F0IjoiMjAyNi0wOS0wNVQwMDowMTowMFoiLCJ0ZW5hbnRfaWQiOiJ0ZW5hbnQtMSJ9XSwic2NoZW1hIjoiaHR0cHM6Ly9naXRodWIuY29tL2ltbXU0OTg5L2x1cmViZW5jaC9zcGVjL2x1cmVjaGFubmVsLXBsYW4tdjEiLCJzY2hlbWFfdmVyc2lvbiI6MSwic2Vuc29ycyI6W3siY2hhbm5lbF9pZHMiOlsiYXBwcm92ZWQtY29sbGFiIl0sInNlbnNvcl9pZCI6ImNvbGxhYi1zZW5zb3IifSx7ImNoYW5uZWxfaWRzIjpbInNoYXJlZC1maWxlc3lzdGVtIl0sInNlbnNvcl9pZCI6ImZpbGVzeXN0ZW0tc2Vuc29yIn0seyJjaGFubmVsX2lkcyI6WyJwYWNrYWdlLWNhY2hlIl0sInNlbnNvcl9pZCI6InBhY2thZ2Utc2Vuc29yIn1dLCJ0ZXN0cyI6W3siY2hhbm5lbF9pZCI6ImFwcHJvdmVkLWNvbGxhYiIsImV4cGVjdGF0aW9uIjoiZGVsaXZlciIsIm1heGltdW1fZGVsaXZlcnlfbXMiOjEwMDAsIm9ic2VydmVyX3J1bl9pZCI6InJ1bi1iIiwicGhhc2UiOiJhY3RpdmUiLCJyZXF1aXJlZF9zZW5zb3JfaWRzIjpbImNvbGxhYi1zZW5zb3IiXSwic291cmNlX3J1bl9pZCI6InJ1bi1hIiwidGVzdF9pZCI6ImFjdGl2ZS1hcHByb3ZlZC1jb250cm9sIn0seyJjaGFubmVsX2lkIjoicGFja2FnZS1jYWNoZSIsImV4cGVjdGF0aW9uIjoiaXNvbGF0ZSIsIm1heGltdW1fZGVsaXZlcnlfbXMiOjEwMDAsIm9ic2VydmVyX3J1bl9pZCI6InJ1bi1iIiwicGhhc2UiOiJhY3RpdmUiLCJyZXF1aXJlZF9zZW5zb3JfaWRzIjpbInBhY2thZ2Utc2Vuc29yIl0sInNvdXJjZV9ydW5faWQiOiJydW4tYSIsInRlc3RfaWQiOiJhY3RpdmUtcGFja2FnZS1pc29sYXRpb24ifSx7ImNoYW5uZWxfaWQiOiJzaGFyZWQtZmlsZXN5c3RlbSIsImV4cGVjdGF0aW9uIjoiaXNvbGF0ZSIsIm1heGltdW1fZGVsaXZlcnlfbXMiOjEwMDAsIm9ic2VydmVyX3J1bl9pZCI6InJ1bi1iIiwicGhhc2UiOiJwb3N0X3Rlcm1pbmF0aW9uIiwicmVxdWlyZWRfc2Vuc29yX2lkcyI6WyJmaWxlc3lzdGVtLXNlbnNvciJdLCJzb3VyY2VfcnVuX2lkIjoicnVuLWEiLCJ0ZXN0X2lkIjoicG9zdC10ZXJtaW5hdGlvbi1yZXNpZHVlIn1dfSwicGxhbl9zaGEyNTYiOiJlNmYxYTIxZjM4MDAyNTgzZmRhYzFhYmJhYjZkY2YxNDU4YTkzMmQ0YmRlYzI5MjE4MmI4YzgzNDE2YzBhNTQ3IiwicmVzdWx0cyI6W3siY29tcGxldGVfc2Vuc29yX3dpbmRvd19jb3VudCI6MSwiZXhwZWN0YXRpb24iOiJkZWxpdmVyIiwiZmluZGluZ3MiOltdLCJwaGFzZSI6ImFjdGl2ZSIsInJlcXVpcmVkX3NlbnNvcl93aW5kb3dfY291bnQiOjEsInNpZ2h0aW5nX2NvdW50IjoxLCJzdGF0dXMiOiJwYXNzIiwidGVzdF9pZCI6ImFjdGl2ZS1hcHByb3ZlZC1jb250cm9sIn0seyJjb21wbGV0ZV9zZW5zb3Jfd2luZG93X2NvdW50IjoxLCJleHBlY3RhdGlvbiI6Imlzb2xhdGUiLCJmaW5kaW5ncyI6W10sInBoYXNlIjoiYWN0aXZlIiwicmVxdWlyZWRfc2Vuc29yX3dpbmRvd19jb3VudCI6MSwic2lnaHRpbmdfY291bnQiOjAsInN0YXR1cyI6InBhc3MiLCJ0ZXN0X2lkIjoiYWN0aXZlLXBhY2thZ2UtaXNvbGF0aW9uIn0seyJjb21wbGV0ZV9zZW5zb3Jfd2luZG93X2NvdW50IjoxLCJleHBlY3RhdGlvbiI6Imlzb2xhdGUiLCJmaW5kaW5ncyI6W10sInBoYXNlIjoicG9zdF90ZXJtaW5hdGlvbiIsInJlcXVpcmVkX3NlbnNvcl93aW5kb3dfY291bnQiOjEsInNpZ2h0aW5nX2NvdW50IjowLCJzdGF0dXMiOiJwYXNzIiwidGVzdF9pZCI6InBvc3QtdGVybWluYXRpb24tcmVzaWR1ZSJ9XSwicnVuIjp7ImNhbXBhaWduX2lkIjoiaXNvbGF0aW9uLWNhbXBhaWduLTEiLCJjb21wbGV0ZWRfYXQiOiIyMDI2LTA5LTA1VDAwOjA3OjAwWiIsImxpbWl0YXRpb25zIjpbImNhbmFyeV9hYnNlbmNlX29ubHlfYXBwbGllc190b19kZWNsYXJlZF9jaGFubmVsc19zZW5zb3JzX3dpbmRvd3NfYW5kX3J1bnMiLCJzZW5zb3JfY29tcGxldGVuZXNzX2lzX29wZXJhdG9yX2Fzc2VydGVkX25vdF9pbmRlcGVuZGVudGx5X2Rpc2NvdmVyZWQiLCJjYW5hcmllc19kb19ub3RfZXhlY3V0ZV9leHBsb2l0c19vcl9lc3RhYmxpc2hfdW5pdmVyc2FsX25vbmludGVyZmVyZW5jZSIsInBhc3NpbmdfaXNfbm90X2NvbnRhaW5tZW50X3NhZmV0eV9jb21wbGlhbmNlX2NlcnRpZmljYXRpb25fb3JfZGVwbG95bWVudF9hdXRob3JpemF0aW9uIl0sIm9ic2VydmF0aW9uX2lkIjoiaXNvbGF0aW9uLW9ic2VydmF0aW9uLTEiLCJwbGFuX3NoYTI1NiI6ImU2ZjFhMjFmMzgwMDI1ODNmZGFjMWFiYmFiNmRjZjE0NThhOTMyZDRiZGVjMjkyMTgyYjhjODM0MTZjMGE1NDciLCJwcml2YWN5Ijp7ImNhbmFyeV9wYXlsb2FkcyI6ImV4Y2x1ZGVkX2RpZ2VzdF9vbmx5IiwiY3VzdG9tZXJfY29udGVudCI6ImV4Y2x1ZGVkIiwic2VjcmV0cyI6ImV4Y2x1ZGVkIn0sInByb2JlcyI6W3siY2FuYXJ5X3NoYTI1NiI6IjExMTExMTExMTExMTExMTExMTExMTExMTExMTExMTExMTExMTExMTExMTExMTExMTExMTExMTExMTExMTExMTEiLCJlbWl0dGVkX2F0IjoiMjAyNi0wOS0wNVQwMDowMjowMFoiLCJwcm9iZV9pZCI6InByb2JlLWFwcHJvdmVkIiwic2lnaHRpbmdzIjpbeyJjaGFubmVsX2lkIjoiYXBwcm92ZWQtY29sbGFiIiwib2JzZXJ2ZWRfYXQiOiIyMDI2LTA5LTA1VDAwOjAyOjAwLjIwMDAwMFoiLCJvYnNlcnZlcl9ydW5faWQiOiJydW4tYiIsInNlbnNvcl9pZCI6ImNvbGxhYi1zZW5zb3IiLCJzaWdodGluZ19pZCI6InNpZ2h0aW5nLWFwcHJvdmVkIn1dLCJ0ZXN0X2lkIjoiYWN0aXZlLWFwcHJvdmVkLWNvbnRyb2wifSx7ImNhbmFyeV9zaGEyNTYiOiIyMjIyMjIyMjIyMjIyMjIyMjIyMjIyMjIyMjIyMjIyMjIyMjIyMjIyMjIyMjIyMjIyMjIyMjIyMjIyMjIyMjIyIiwiZW1pdHRlZF9hdCI6IjIwMjYtMDktMDVUMDA6MDM6MDBaIiwicHJvYmVfaWQiOiJwcm9iZS1wYWNrYWdlIiwic2lnaHRpbmdzIjpbXSwidGVzdF9pZCI6ImFjdGl2ZS1wYWNrYWdlLWlzb2xhdGlvbiJ9LHsiY2FuYXJ5X3NoYTI1NiI6IjMzMzMzMzMzMzMzMzMzMzMzMzMzMzMzMzMzMzMzMzMzMzMzMzMzMzMzMzMzMzMzMzMzMzMzMzMzMzMzMzMzMzMiLCJlbWl0dGVkX2F0IjoiMjAyNi0wOS0wNVQwMDowNTozMFoiLCJwcm9iZV9pZCI6InByb2JlLXJlc2lkdWUiLCJzaWdodGluZ3MiOltdLCJ0ZXN0X2lkIjoicG9zdC10ZXJtaW5hdGlvbi1yZXNpZHVlIn1dLCJzY2hlbWEiOiJodHRwczovL2dpdGh1Yi5jb20vaW1tdTQ5ODkvbHVyZWJlbmNoL3NwZWMvbHVyZWNoYW5uZWwtcnVuLXYxIiwic2NoZW1hX3ZlcnNpb24iOjEsInNlbnNvcl93aW5kb3dzIjpbeyJjaGFubmVsX2lkIjoiYXBwcm92ZWQtY29sbGFiIiwiY2xvc2VkX2F0IjoiMjAyNi0wOS0wNVQwMDowNzowMFoiLCJjb21wbGV0ZSI6dHJ1ZSwib3BlbmVkX2F0IjoiMjAyNi0wOS0wNVQwMDowMTowMFoiLCJzZW5zb3JfaWQiOiJjb2xsYWItc2Vuc29yIn0seyJjaGFubmVsX2lkIjoic2hhcmVkLWZpbGVzeXN0ZW0iLCJjbG9zZWRfYXQiOiIyMDI2LTA5LTA1VDAwOjA3OjAwWiIsImNvbXBsZXRlIjp0cnVlLCJvcGVuZWRfYXQiOiIyMDI2LTA5LTA1VDAwOjAxOjAwWiIsInNlbnNvcl9pZCI6ImZpbGVzeXN0ZW0tc2Vuc29yIn0seyJjaGFubmVsX2lkIjoicGFja2FnZS1jYWNoZSIsImNsb3NlZF9hdCI6IjIwMjYtMDktMDVUMDA6MDc6MDBaIiwiY29tcGxldGUiOnRydWUsIm9wZW5lZF9hdCI6IjIwMjYtMDktMDVUMDA6MDE6MDBaIiwic2Vuc29yX2lkIjoicGFja2FnZS1zZW5zb3IifV0sInN0YXJ0ZWRfYXQiOiIyMDI2LTA5LTA1VDAwOjAxOjAwWiJ9LCJydW5fc2hhMjU2IjoiNGUxMzc1NDVlZDM5NTE0OTlkYjk3YzUxMWZjNjAyMmNmYTJiOGQ2YjBmZDNlNWUyZDAxN2Y1NTAyYWE3MTdkYSIsInNjaGVtYSI6Imh0dHBzOi8vZ2l0aHViLmNvbS9pbW11NDk4OS9sdXJlYmVuY2gvc3BlYy9sdXJlY2hhbm5lbC1ldmFsdWF0aW9uLXYxIiwic2NoZW1hX3ZlcnNpb24iOjEsInN1bW1hcnkiOnsiY2xlYW5faXNvbGF0aW9uX3Rlc3RfY291bnQiOjIsImNvbXBsZXRlX3NlbnNvcl93aW5kb3dfY291bnQiOjMsImRlbGl2ZXJlZF9jb250cm9sX2NvdW50IjoxLCJkZWxpdmVyeV9jb250cm9sX2NvdW50IjoxLCJkZWxpdmVyeV9jb250cm9sX3JhdGUiOjEuMCwiZmFpbGVkX3Rlc3RfY291bnQiOjAsImZpbmRpbmdfY291bnQiOjAsImluY29uY2x1c2l2ZV90ZXN0X2NvdW50IjowLCJpc29sYXRpb25fdGVzdF9jb3VudCI6MiwicGFzc2VkX3Rlc3RfY291bnQiOjMsInJlcXVpcmVkX3NlbnNvcl93aW5kb3dfY291bnQiOjMsInJlc2lkdWFsX2Zsb3dfY291bnQiOjAsInNlbnNvcl9jb3ZlcmFnZV9yYXRlIjoxLjAsInNpZ2h0aW5nX2NvdW50IjoxLCJ0ZXN0X2NvdW50IjozLCJ1bmF1dGhvcml6ZWRfZmxvd19jb3VudCI6MCwidmVyZGljdCI6InBhc3MifX0K"},"plan":{"document_sha256":"9631e7baf673b0c68406472f44ea6d94edbce0c24efcfc42b7d9eed82f84ba91","payload_base64":"ewogICJzY2hlbWEiOiAiaHR0cHM6Ly9naXRodWIuY29tL2ltbXU0OTg5L2x1cmViZW5jaC9zcGVjL2x1cmVjaGFubmVsLXBsYW4tdjEiLAogICJzY2hlbWFfdmVyc2lvbiI6IDEsCiAgImNhbXBhaWduX2lkIjogImlzb2xhdGlvbi1jYW1wYWlnbi0xIiwKICAiY3JlYXRlZF9hdCI6ICIyMDI2LTA5LTA1VDAwOjAwOjAwWiIsCiAgImVudmlyb25tZW50IjogewogICAgImVudmlyb25tZW50X2lkIjogInJlc2VhcmNoLXNhbmRib3gtMSIsCiAgICAidGVuYW50X2lkIjogInRlbmFudC0xIgogIH0sCiAgInJ1bnMiOiBbCiAgICB7CiAgICAgICJydW5faWQiOiAicnVuLWEiLAogICAgICAiaXNvbGF0aW9uX2RvbWFpbl9pZCI6ICJkb21haW4tYSIsCiAgICAgICJ0ZW5hbnRfaWQiOiAidGVuYW50LTEiLAogICAgICAic3RhcnRlZF9hdCI6ICIyMDI2LTA5LTA1VDAwOjAxOjAwWiIsCiAgICAgICJlbmRlZF9hdCI6ICIyMDI2LTA5LTA1VDAwOjA1OjAwWiIKICAgIH0sCiAgICB7CiAgICAgICJydW5faWQiOiAicnVuLWIiLAogICAgICAiaXNvbGF0aW9uX2RvbWFpbl9pZCI6ICJkb21haW4tYiIsCiAgICAgICJ0ZW5hbnRfaWQiOiAidGVuYW50LTEiLAogICAgICAic3RhcnRlZF9hdCI6ICIyMDI2LTA5LTA1VDAwOjAxOjAwWiIsCiAgICAgICJlbmRlZF9hdCI6IG51bGwKICAgIH0KICBdLAogICJjaGFubmVscyI6IFsKICAgIHsKICAgICAgImNoYW5uZWxfaWQiOiAiYXBwcm92ZWQtY29sbGFiIiwKICAgICAgImNoYW5uZWxfY2xhc3MiOiAiYXBwcm92ZWRfY29sbGFib3JhdGlvbiIsCiAgICAgICJhdXRob3JpemVkIjogdHJ1ZQogICAgfSwKICAgIHsKICAgICAgImNoYW5uZWxfaWQiOiAicGFja2FnZS1jYWNoZSIsCiAgICAgICJjaGFubmVsX2NsYXNzIjogInBh